{
  "task_version": "1.0",
  "curriculum_id": "ACE-ALGEBRA1",
  "curriculum_version": "1.1.0",
  "target_skill_id": "Q07",
  "title": "Equations with brackets",
  "instructions": "Work independently first. You may ask for help when needed.",
  "maximum_minutes": 20,
  "issued_at": "2026-10-21T02:00:00Z",
  "expires_at": "2026-10-28T02:00:00Z"
}
